Collection;"Record Number";"Project acronym";Title;ID;Teaser;"Domains of application";Programmes;"Fields of science";"Project start date";"Project end date";Language;"Available languages";"Last updated";URL
pubsum;46140;;"Final Report Summary - SC2020 (Science in Europe 2020)";218869_PS;"Background of the project 'Science in Europe 2020'

Founded in 1950 the European Broadcasting Union (EBU) is the largest association of national broadcasters in the world. It gathers 75 broadcasters from 56 countries in and around Europe. Moreover it has a very large network o...";;FP7-ENVIRONMENT;;;;en;en;"2010-11-02 00:02:53";https://cordis.europa.eu/project/id/218869/reporting
project;91261;COMENVIR;"Communicating environmental impacts on water quality, availability and use";226919;"The ComEnvir project aims to narrow the gap between EU sponsored environmental research and European citizens. Water (resources, quality, pollution and biodiversity issues) has been chosen as a common theme to be addressed by the project. It will cover environmental stressors...";;FP7-ENVIRONMENT;"/social sciences/educational sciences/didactics;/natural sciences/earth and related environmental sciences/hydrology;/natural sciences/earth and related environmental sciences/environmental sciences/pollution;/natural sciences/biological sciences/ecology/ecosystems;/engineering and technology/environmental engineering/waste management/waste treatment processes";2009-05-01;2013-04-30;en;en;"2022-05-25 14:28:40";https://cordis.europa.eu/project/id/226919
pubsum;202073;;"Periodic Reporting for period 2 - SOUND (Statistical multi-Omics UNDerstanding of Patient Samples)";633974_PS;"Our objective has been to enable European and international researchers to increase statistically informed use of personal multi-omic data for biomedical research. The bioinformatic and statistical analysis of the large, heterogeneous and complex data sets that are produced in...";;H2020-EU.3.1.,H2020-EU.3.1.6.;;;;en;en;"2021-02-26 20:22:23";https://cordis.europa.eu/project/id/633974/reporting
pubsum;149876;;"Final Report Summary - ASIMUTH (Applied simulations and Integrated modeling for the understanding of toxic and harmful algal blooms)";261860_PS;"Executive Summary:Reasons for the emergent interest in HABs are abundant, including concerns associated with human health, adverse effects on biological resources, economic losses attributed to recreation, tourism and seafood related industries, and the cost of maintaining...";;FP7-SPACE;;;;en;en;"2014-10-31 14:53:58";https://cordis.europa.eu/project/id/261860/reporting
pubsum;187946;;"Final Report Summary - RURBANAFRICA (African Rural-City Connections)";290732_PS;"Africa currently has a low proportion of its population living in cities and towns. This is rapidly changing, however, and by the middle of this century it is predicted that the majority of Africans will be urban residents. Understanding the connections between rural areas and...";;FP7-SSH;;;;en;en;"2016-08-12 13:13:08";https://cordis.europa.eu/project/id/290732/reporting
project;102150;FARSEEING;"FAll  Repository for the design of Smart and sElf-adaptive Environments prolonging INdependent livinG";288940;"Healthy independent living is a major challenge for the ageing European population. Promotion of stimulating physical activity and prevention of falls are two key factors. Smart ICT offers unique proactive opportunities to support older people in their own homes. The FARSEEIN...";;FP7-ICT;"/natural sciences/computer and information sciences/databases;/natural sciences/computer and information sciences/computer security/data protection;/social sciences/economics and business/business and management/business models;/engineering and technology/electrical engineering, electronic engineering, information engineering/electronic engineering/sensors;/engineering and technology/electrical engineering, electronic engineering, information engineering/information engineering/telecommunications/mobile phones";2012-01-01;2015-03-31;en;en;"2017-04-22 03:12:06";https://cordis.europa.eu/project/id/288940
news;435709;;"Investigating Europe’s life-saving lockdown policies";435709-investigating-europe-s-life-saving-lockdown-policies;"According to a new study, hundreds of deaths were likely avoided thanks to lower air pollution levels resulting from Europe’s first COVID-19 lockdown phase.";Health;;;;;en;de,en,es,fr,it,pl;"2022-02-16 15:56:02";https://cordis.europa.eu/article/id/435709-investigating-europe-s-life-saving-lockdown-policies
