Collection;"Record Number";"Project acronym";Title;ID;Teaser;"Domains of application";Programmes;"Fields of science";"Project start date";"Project end date";Language;"Available languages";"Last updated";URL
pubsum;196511;;"Final Report Summary - CAPHAZ-NET (Social Capacity Building for Natural Hazards: Toward More Resilient Societies)";227073_PS;"The CapHaz-Net consortium developed a processual and actor-oriented understanding of social capacity building embedded in a framework of risk governance. Moreover, it identified and assessed existing practices and policies for social capacity building in the field of natural...";;FP7-ENVIRONMENT;;;;en;en;"2017-03-27 14:59:39";https://cordis.europa.eu/project/id/227073/reporting
news;442714;;"Citizen science – engagement and empowerment";442714-citizen-science-engagement-and-empowerment;"Enthusiasts, people with hobbies, with spare time or concerned about their environment – you and me: all of us are potential collectors of data and information that can add a dimension to research projects. How can participation empower volunteers? And what’s the benefit for scientists? Listen on to find out!";Society;;;;;en;de,en,es,fr,it,pl;"2022-12-16 13:30:51";https://cordis.europa.eu/article/id/442714-citizen-science-engagement-and-empowerment
project;217646;D-NOSES;"Distributed Network for Odour Sensing, Empowerment and Sustainability";789315;"Odour pollution is the second reason for citizens’ complaints after noise, across Europe. Frequent exposure to odour is associated with headache, stress and respiratory problems. Odour nuisance is an indicator of larger environmental issues, such as poor waste management or...";;H2020-EU.5.f.;"/social sciences/sociology/governance;/social sciences/political sciences/political policies/civil society/nongovernmental organizations;/engineering and technology/environmental engineering/waste management;/natural sciences/earth and related environmental sciences/environmental sciences/pollution";2018-04-01;2021-09-30;en;en;"2022-10-28 14:00:01";https://cordis.europa.eu/project/id/789315
pubsum;159425;;"Final Report Summary - FOODRISC (Food Risk Communication. Perceptions and communication of food risks/benefits across Europe: development of effective communication strategies.)";245124_PS;"Executive Summary:FoodRisC is an EU-funded project involving 13 partner organisations from 9 European countries which has explored perceptions and communication of food risk/benefit issues across Europe. European consumers are faced with a myriad of food related risk and...";;FP7-KBBE;;;;en;en;"2015-04-01 15:03:51";https://cordis.europa.eu/project/id/245124/reporting
pubsum;57537;;"Final Report Summary 1 - COMSCIENCE (ComScience Network: providing added value to EU research dissemination efforts at regional level)";230470_PS;"COMSCIENCE was part of the 'Science in society' Work Programme and of the 'Capacities' Work Programme of the Seventh Framework Programme (FP7). COMSCIENCE focused on the first of three main activities: 'better understanding of the place of science and technology in society', a...";;FP7-SIS;;;;en;en;"2013-08-14 00:02:53";https://cordis.europa.eu/project/id/230470/reporting
