Collection;"Record Number";"Project acronym";Title;ID;Teaser;"Domains of application";Programmes;"Fields of science";"Project start date";"Project end date";Language;"Available languages";"Last updated";URL
brief;85798;;"Harnessing the power of biodiversity research";85798-harnessing-the-power-of-biodiversity-research;"Biodiversity, the variety of life on earth,is a complex system of genes, species and their interactions and is vital to our planet, the economy, health and well-being of all species. This EU-funded project to create a research infrastructure will assist researchers to improve our understanding of biodiversity and the ecosystems that support it.";"Climate Change and Environment";FP7-INFRASTRUCTURES;;;;en;de,en,es,fr,it,pl;"2010-11-10 16:40:44";https://cordis.europa.eu/article/id/85798-harnessing-the-power-of-biodiversity-research
news;22091;;"France wants environment to be on equal footing with human and social rights";22091-france-wants-environment-to-be-on-equal-footing-with-human-and-social-rights;"French President Jacques Chirac has suggested making a drastic change to the French constitution, giving environmental issues the same importance as human, economic and social rights.

In an announcement that has lead to an outcry among scientists and politicians alike, Mr Chi...";;;;;;en;de,en,es,fr,it;"2004-05-28 00:00:02";https://cordis.europa.eu/article/id/22091-france-wants-environment-to-be-on-equal-footing-with-human-and-social-rights
brief;421777;;"Online platform promotes nature itself in confronting big global challenges";421777-online-platform-promotes-nature-itself-in-confronting-big-global-challenges;"Humanity urgently needs to identify promising alternatives that address challenges linked to climate change, sustainable energy, food security, and economic and social development. The EU is promoting the uptake of nature-based solutions (NBS) identified as alternatives with great potential in tackling such universal concerns.";"Digital Economy,Climate Change and Environment,Society";H2020-EU.3.5.,H2020-EU.3.5.1.,H2020-EU.3.5.2.;;;;en;de,en,es,fr,it,pl,pt;"2020-08-07 15:58:25";https://cordis.europa.eu/article/id/421777-online-platform-promotes-nature-itself-in-confronting-big-global-challenges
pubsum;715448;;"Periodic Reporting for period 1 - REGREEN (Fostering nature-based solutions for smart, green and healthy urban transitions in Europe and China)";821016_PS;"Urban systems globally experience significant and interlinked societal challenges including pressures on public health and well-being and growing inequalities and social disruption. At the same time, urban systems are particularly vulnerable to impacts of climate change and...";;H2020-EU.3.5.,H2020-EU.3.5.4.,H2020-EU.3.5.1.,H2020-EU.3.5.2.;;;;en;en;"2021-09-02 20:44:41";https://cordis.europa.eu/project/id/821016/reporting
pubsum;169018;;"Final Report Summary - NOVO (Novel approaches for prevention and degeneration of pathogenic bacteria biofilms formed on medical devices e.g. catheters)";278402_PS;"Executive Summary:Executive summary  The resistance of microbial biofilms to the immune system and to antibiotics has is a common cause of medical infections, and of difficult-to-treat infections caused by colonized foreign bodies. More than 60% of bacterial infections...";;FP7-HEALTH;;;;en;en;"2015-08-24 17:59:45";https://cordis.europa.eu/project/id/278402/reporting
